{
  "$schema": "https://json-schema.org/draft/2020-12/schema",
  "$id": "https://registryops.org/schemas/publication_manifest.schema.json",
  "title": "RegistryOps Publication Manifest",
  "type": "object",
  "additionalProperties": false,
  "required": [
    "publication_id",
    "publication_line",
    "publication_status",
    "published_at",
    "event_count",
    "events_sha256",
    "merkle_root_sha256",
    "journal_path",
    "proof_status_path"
  ],
  "properties": {
    "publication_id": {
      "type": "string",
      "minLength": 1
    },
    "publication_line": {
      "type": "string",
      "enum": [
        "phase1",
        "phase2",
        "pre-normative"
      ]
    },
    "publication_status": {
      "type": "string",
      "enum": [
        "canonical",
        "pre-normative"
      ]
    },
    "published_at": {
      "type": "string",
      "pattern": "^\\d{4}-\\d{2}-\\d{2}T\\d{2}:\\d{2}:\\d{2}Z$"
    },
    "event_count": {
      "type": "integer",
      "minimum": 0
    },
    "events_sha256": {
      "type": "string",
      "pattern": "^[a-f0-9]{64}$"
    },
    "merkle_root_sha256": {
      "type": "string",
      "pattern": "^[a-f0-9]{64}$"
    },
    "journal_path": {
      "type": "string",
      "const": "journal/events.jsonl"
    },
    "proof_status_path": {
      "type": "string",
      "const": "integrity/proof_status.json"
    }
  }
}
