{
  "publication_id": "phase1-000004",
  "publication_line": "phase1",
  "publication_status": "canonical",
  "published_at": "2026-04-07T14:04:58Z",
  "event_count": 13,
  "events_sha256": "1537c32472b705f3a9b83dfabdb7597fc6b28b6524654c7652d7efbf4f916d4d",
  "merkle_root_sha256": "bbeecb064c3fe7abeb62a9002fe5c59d5eb4fe2db5fbbbf44334baa4f64c2fb3",
  "journal_path": "journal/events.jsonl",
  "proof_status_path": "integrity/proof_status.json"
}
