{
  "publication_id": "phase2-000083",
  "publication_line": "phase2",
  "publication_status": "canonical",
  "published_at": "2026-07-08T14:45:29Z",
  "event_count": 465,
  "events_sha256": "628c93e07b4716021f45b08cd02d4474b8ec08561fee582e7ad727fb24e79201",
  "merkle_root_sha256": "58a12db159807c5a8e549229328aba0b08d8086ab4bb9e0b480555a68933d38c",
  "journal_path": "journal/events.jsonl",
  "proof_status_path": "integrity/proof_status.json"
}
