{
  "publication_id": "phase2-000006",
  "publication_line": "phase2",
  "publication_status": "canonical",
  "published_at": "2026-05-24T04:45:32Z",
  "event_count": 176,
  "events_sha256": "028613e4baed6e230ceadd608ce7ab4eb97b4b010c2c0c2bcbc82606a5ea473a",
  "merkle_root_sha256": "84c0029182ac2013000b617d2c99aa9c46680ad3681edf035fd8be473348d283",
  "journal_path": "journal/events.jsonl",
  "proof_status_path": "integrity/proof_status.json"
}
