{
  "publication_id": "phase2-000034",
  "publication_line": "phase2",
  "publication_status": "canonical",
  "published_at": "2026-06-13T19:59:06Z",
  "event_count": 301,
  "events_sha256": "61746a0689bf21d43921adb6356996ab6efee50fbad174d3b265e4feb3f4227f",
  "merkle_root_sha256": "0328abeb4ef079b170234781e54a61ca4977d15af19445756792bba6dcde435b",
  "journal_path": "journal/events.jsonl",
  "proof_status_path": "integrity/proof_status.json"
}
