{
  "publication_id": "phase2-000040",
  "publication_line": "phase2",
  "publication_status": "canonical",
  "published_at": "2026-06-20T14:37:51Z",
  "event_count": 343,
  "events_sha256": "d280f8ca2327f89ec79a93ad723153c4d9fcb7c2b01c92f46cc6aadc10d8e54e",
  "merkle_root_sha256": "0d5c59ce499c1fe257f9b3c7897d73cb234d4ff1d6a014aa5e162087f880a4b0",
  "journal_path": "journal/events.jsonl",
  "proof_status_path": "integrity/proof_status.json"
}
