{
  "publication_id": "phase2-000048",
  "publication_line": "phase2",
  "publication_status": "canonical",
  "published_at": "2026-06-25T09:49:33Z",
  "event_count": 371,
  "events_sha256": "b8a61ea37fec4357c2e4807f7896f783b029a268159350f4cb37cb01edc8b897",
  "merkle_root_sha256": "7b4f540e8904c39748e6e38a44400f44a34be1b01e6bc0973cd2ff250245c0ed",
  "journal_path": "journal/events.jsonl",
  "proof_status_path": "integrity/proof_status.json"
}
