{
  "publication_id": "phase2-000013",
  "publication_line": "phase2",
  "publication_status": "canonical",
  "published_at": "2026-05-27T10:34:33Z",
  "event_count": 193,
  "events_sha256": "6ddd736e5275b8a2a5ef6e7f9066103353f1f1866bc8cb0c14a14637538e0ec3",
  "merkle_root_sha256": "99f4af8c9fb895cc8bba7660ed8e0ba2f7271f58a7446cfb86fabf98f2b0fc3a",
  "journal_path": "journal/events.jsonl",
  "proof_status_path": "integrity/proof_status.json"
}
