{
  "publication_id": "phase2-000086",
  "publication_line": "phase2",
  "publication_status": "canonical",
  "published_at": "2026-07-09T15:39:21Z",
  "event_count": 475,
  "events_sha256": "9effa1bd3944b7e245692bcccf059855ed4b920b820e6e3904740d79bb1b9e89",
  "merkle_root_sha256": "daac36338b43b6c760ea1a4d569b3d7e07c2716bfa09bcc1a0af3e067a2b9f46",
  "journal_path": "journal/events.jsonl",
  "proof_status_path": "integrity/proof_status.json"
}
