{
  "publication_id": "phase1-000003",
  "publication_line": "phase1",
  "publication_status": "canonical",
  "published_at": "2026-04-06T13:57:08Z",
  "event_count": 9,
  "events_sha256": "ee42675f78384deee13e4f61f80b2b8742c9e4cfce3fb7a66b38f9e0e67e5a36",
  "merkle_root_sha256": "8ce17e06ba9c641a67bd2a6743d125c4405bb6b9c35b86190d456d1dd7a64b6a",
  "journal_path": "journal/events.jsonl",
  "proof_status_path": "integrity/proof_status.json"
}
