{
  "publication_id": "phase2-000054",
  "publication_line": "phase2",
  "publication_status": "canonical",
  "published_at": "2026-06-28T14:20:27Z",
  "event_count": 392,
  "events_sha256": "3e22acfb793f8db5960624b6206d3e912fed13830e07f62aec493f94bd927d76",
  "merkle_root_sha256": "0dcc71e15d2873d26fb4fcbf08c822fc379e1b528d5b12e1b1f9a9b1befb753e",
  "journal_path": "journal/events.jsonl",
  "proof_status_path": "integrity/proof_status.json"
}
