{
  "publication_id": "phase2-000067",
  "publication_line": "phase2",
  "publication_status": "canonical",
  "published_at": "2026-07-03T14:36:47Z",
  "event_count": 421,
  "events_sha256": "2d9f6d2ab004fc3e4ff7094056326eac4fed35ee6dbc09b52e5d76a63e97506d",
  "merkle_root_sha256": "b6662b5545c92352d3e4e755a3147a30c3c5e56ae402f9aba36cfb5665a6c56a",
  "journal_path": "journal/events.jsonl",
  "proof_status_path": "integrity/proof_status.json"
}
