{
  "publication_id": "phase2-000008",
  "publication_line": "phase2",
  "publication_status": "canonical",
  "published_at": "2026-05-25T04:59:04Z",
  "event_count": 181,
  "events_sha256": "ad0df5fe0ab88ad8058c49ae8746929a617e3992d6380417867349ccd79127b6",
  "merkle_root_sha256": "ee1e4f688d7156c4c81a6f4349de88ba7317be62111264a6ad51176a3a5e6c05",
  "journal_path": "journal/events.jsonl",
  "proof_status_path": "integrity/proof_status.json"
}
