{
  "publication_id": "phase1-000005",
  "publication_line": "phase1",
  "publication_status": "canonical",
  "published_at": "2026-04-08T14:06:43Z",
  "event_count": 17,
  "events_sha256": "efe66d5e0bf6d1744d62c395395e21dbc4542a9a2d517d903987ad2854c9c510",
  "merkle_root_sha256": "eaee742b00da9493d3c8af5f8a51a36854824bebdb65ef2b19221861e3a781c6",
  "journal_path": "journal/events.jsonl",
  "proof_status_path": "integrity/proof_status.json"
}
