{
  "publication_id": "phase1-000015",
  "publication_line": "phase1",
  "publication_status": "canonical",
  "published_at": "2026-04-20T03:54:58Z",
  "event_count": 57,
  "events_sha256": "c7a47edfe7d0270aa83477aa710c7dbf142d475d146261890bfd608079ee4929",
  "merkle_root_sha256": "92f9854265828ba64450a372619e0780c08e05a9987b414bf8274735ee8eb4c0",
  "journal_path": "journal/events.jsonl",
  "proof_status_path": "integrity/proof_status.json"
}
