{
  "publication_id": "phase2-000078",
  "publication_line": "phase2",
  "publication_status": "canonical",
  "published_at": "2026-07-06T15:58:05Z",
  "event_count": 450,
  "events_sha256": "8104d7af85c09cacedadff21f0faf20396aa51944895ce9458aeab621c85ec90",
  "merkle_root_sha256": "29eb32550bc945eff353a5ea1cde8c934375280a9a1c9549e55238cd357eba8f",
  "journal_path": "journal/events.jsonl",
  "proof_status_path": "integrity/proof_status.json"
}
