{
  "publication_id": "phase1-000031",
  "publication_line": "phase1",
  "publication_status": "canonical",
  "published_at": "2026-05-08T19:49:30Z",
  "event_count": 121,
  "events_sha256": "93498ef5f90cc844c2ff90e04d60e651c08540057fc3dcafd1a95b3e783a692f",
  "merkle_root_sha256": "e46e429a3060a232ab9f4df5f250f229fcd1010786010875e5c75063e4797730",
  "journal_path": "journal/events.jsonl",
  "proof_status_path": "integrity/proof_status.json"
}
