{
  "publication_id": "phase2-000056",
  "publication_line": "phase2",
  "publication_status": "canonical",
  "published_at": "2026-06-29T11:29:10Z",
  "event_count": 397,
  "events_sha256": "3888c658cf01eee4256b800f96c34cb08ddac9f8db1e522f70949ae5c8124008",
  "merkle_root_sha256": "56ce9cfbf4cea23dca8558fef32ae99a2876720bad73293d365ff4cf31a6f0cf",
  "journal_path": "journal/events.jsonl",
  "proof_status_path": "integrity/proof_status.json"
}
