{
  "publication_id": "phase2-000028",
  "publication_line": "phase2",
  "publication_status": "canonical",
  "published_at": "2026-06-07T05:01:20Z",
  "event_count": 259,
  "events_sha256": "c582e62de5460f0bb78a974867cef8963f6adcba34af43458cde4f4c9270937e",
  "merkle_root_sha256": "d08793960f505440ac5fbabce1c63337a8539e7dcf4d7956325e3932b8199c25",
  "journal_path": "journal/events.jsonl",
  "proof_status_path": "integrity/proof_status.json"
}
