{
  "publication_id": "phase1-000020",
  "publication_line": "phase1",
  "publication_status": "canonical",
  "published_at": "2026-04-26T03:59:09Z",
  "event_count": 77,
  "events_sha256": "a32e5d63bae4753716522466057ab95c34b087c620dcddf52ff252e14cc1a3f2",
  "merkle_root_sha256": "ded47579d2f29ed7e8fb25fad88526e5d9f5aadb1919a5ab68654cd97f2d8588",
  "journal_path": "journal/events.jsonl",
  "proof_status_path": "integrity/proof_status.json"
}
