{
  "publication_id": "phase2-000074",
  "publication_line": "phase2",
  "publication_status": "canonical",
  "published_at": "2026-07-05T14:14:15Z",
  "event_count": 440,
  "events_sha256": "bb0db6aca6ef96392fb08a8ef919990b95bce3ccf8e2284f1fc210ed969fd90b",
  "merkle_root_sha256": "2493751bb994a51263b158e16071f65c286062baa51961f57f6b11081e0f1ec9",
  "journal_path": "journal/events.jsonl",
  "proof_status_path": "integrity/proof_status.json"
}
