{
  "publication_id": "phase1-000013",
  "publication_line": "phase1",
  "publication_status": "canonical",
  "published_at": "2026-04-17T19:35:42Z",
  "event_count": 49,
  "events_sha256": "e9cb7096098dcb0238cc5ab3863df951de665ebeba144c97e78c690d35ab11c7",
  "merkle_root_sha256": "6e8e312324ae25579eaf6cc18fd70ca8abbf8e344159455be6433674a6f0849b",
  "journal_path": "journal/events.jsonl",
  "proof_status_path": "integrity/proof_status.json"
}
