{
  "publication_id": "phase2-000058",
  "publication_line": "phase2",
  "publication_status": "canonical",
  "published_at": "2026-06-30T10:05:30Z",
  "event_count": 400,
  "events_sha256": "bb5064ca54e59127148fd33c46bb19f42e93da710b96b0fe414e846c95f07a95",
  "merkle_root_sha256": "790be5f8b15b3965e28e5b97e5d0296fa01224dd4023758376f7e42a91a2ab85",
  "journal_path": "journal/events.jsonl",
  "proof_status_path": "integrity/proof_status.json"
}
