{
  "publication_id": "phase2-000063",
  "publication_line": "phase2",
  "publication_status": "canonical",
  "published_at": "2026-07-02T04:36:29Z",
  "event_count": 413,
  "events_sha256": "b8aadf8959a5122386292d14006ae196659ad6c2b9f9c5df577d08d114dd0990",
  "merkle_root_sha256": "5cceec51586f0466eede7f1a716ce0e682835c6b934f6c2dc54e965ced0c0cba",
  "journal_path": "journal/events.jsonl",
  "proof_status_path": "integrity/proof_status.json"
}
