{
  "publication_id": "phase2-000089",
  "publication_line": "phase2",
  "publication_status": "canonical",
  "published_at": "2026-07-10T19:56:28Z",
  "event_count": 485,
  "events_sha256": "9d4054b1ffcaebe76f89d44d5cfb8b1ff4ffe433a622a70a12825d5aea5009a1",
  "merkle_root_sha256": "f9d179beea6a8940ab4bb09dca1d19ca67da63c1f7393573922fd2a7b3fd7047",
  "journal_path": "journal/events.jsonl",
  "proof_status_path": "integrity/proof_status.json"
}
